{
  "strategy_type": "MovingAverageCross",
  "trendMode": "MATREND-002",
  "fastWindow": 2,
  "middleWindow": 5,
  "slowWindow": 13,
  "orderQuantityInUSD": 50000.0,
  "orderQuantity": 47,
  "contract": {
    "symbol": "LLY",
    "secType": "STOCK",
    "currency": "USD",
    "exchange": "IBKR"
  },
  "price_contract": {
    "symbol": "LLY",
    "secType": "STOCK",
    "currency": "USD",
    "exchange": "IBKR"
  },
  "ledgerPath": "data/TraderLedger/MATREND002_LLY_WEEKLY_IBKR",
  "ledgerContextCollection": "MATREND002_LLY_WEEKLY_IBKR_context"
}
