{
  "strategy_type": "MovingAverageCross",
  "trendMode": "MW-001",
  "fastWindow": 2,
  "slowWindow": 6,
  "orderQuantityInUSD": 30000.0,
  "orderQuantity": 249,
  "contract": {
    "symbol": "WMT",
    "secType": "STOCK",
    "currency": "USD",
    "exchange": "IBKR"
  },
  "price_contract": {
    "symbol": "WMT",
    "secType": "STOCK",
    "currency": "USD",
    "exchange": "IBKR"
  },
  "ledgerPath": "data/TraderLedger/MW001_WMT_WEEKLY_30K_IBKR",
  "ledgerContextCollection": "MW001_WMT_WEEKLY_30K_IBKR_context"
}
