{
  "strategy_type": "MovingAverageCross",
  "trendMode": "MW-001",
  "fastWindow": 2,
  "slowWindow": 6,
  "orderQuantityInUSD": 50000.0,
  "orderQuantity": 49,
  "contract": {
    "symbol": "COST",
    "secType": "STOCK",
    "currency": "USD",
    "exchange": "IBKR"
  },
  "price_contract": {
    "symbol": "COST",
    "secType": "STOCK",
    "currency": "USD",
    "exchange": "IBKR"
  },
  "ledgerPath": "data/TraderLedger/MW001_COST_WEEKLY_IBKR",
  "ledgerContextCollection": "MW001_COST_WEEKLY_IBKR_context"
}
