{
  "strategy_type": "MovingAverageCross",
  "trendMode": "MATREND-001",
  "fastWindow": 1,
  "slowWindow": 8,
  "orderQuantityInUSD": 30000.0,
  "orderQuantity": 78,
  "contract": {
    "symbol": "GOOG",
    "secType": "STOCK",
    "currency": "USD",
    "exchange": "IBKR"
  },
  "price_contract": {
    "symbol": "GOOG",
    "secType": "STOCK",
    "currency": "USD",
    "exchange": "IBKR"
  },
  "ledgerPath": "data/TraderLedger/MATREND001_GOOG_WEEKLY_30K_IBKR",
  "ledgerContextCollection": "MATREND001_GOOG_WEEKLY_30K_IBKR_context"
}
