{
  "strategy_type": "MovingAverageCross",
  "trendMode": "MATREND-002",
  "fastWindow": 2,
  "middleWindow": 5,
  "slowWindow": 13,
  "orderQuantityInUSD": 30000.0,
  "orderQuantity": 36,
  "contract": {
    "symbol": "MU",
    "secType": "STOCK",
    "currency": "USD",
    "exchange": "IBKR"
  },
  "price_contract": {
    "symbol": "MU",
    "secType": "STOCK",
    "currency": "USD",
    "exchange": "IBKR"
  },
  "ledgerPath": "data/TraderLedger/MATREND002_MU_WEEKLY_30K_IBKR",
  "ledgerContextCollection": "MATREND002_MU_WEEKLY_30K_IBKR_context"
}
