{
  "strategy_type": "MovingAverageCross",
  "trendMode": "MATREND-001",
  "fastWindow": 1,
  "slowWindow": 8,
  "orderQuantityInUSD": 50000.0,
  "orderQuantity": 188,
  "contract": {
    "symbol": "AMZN",
    "secType": "STOCK",
    "currency": "USD",
    "exchange": "IBKR"
  },
  "price_contract": {
    "symbol": "AMZN",
    "secType": "STOCK",
    "currency": "USD",
    "exchange": "IBKR"
  },
  "ledgerPath": "data/TraderLedger/MATREND001_AMZN_WEEKLY_IBKR",
  "ledgerContextCollection": "MATREND001_AMZN_WEEKLY_IBKR_context"
}
