{
  "strategy_type": "MovingAverageCross",
  "fastWindow": 3,
  "slowWindow": 8,
  "orderQuantityInUSD": 100,
  "orderQuantity": 1,
  "contract": {
    "symbol": "AAPL",
    "secType": "STOCK",
    "currency": "USD",
    "exchange": "BACKTESTER"
  },
  "price_contract": {
    "symbol": "AAPL",
    "secType": "STOCK",
    "currency": "USD",
    "exchange": "BACKTESTER"
  },
  "ledgerPath": "data/TraderLedger/MW001_MAC_AAPL",
  "ledgerContextCollection": "MW001_MAC_AAPL_context"
}
