{
  "strategy_type": "MovingAverageCross",
  "trendMode": "MATREND-001",
  "fastWindow": 24,
  "slowWindow": 34,
  "orderQuantityInUSD": 29678.940000000002,
  "orderQuantity": 61.0,
  "contract": {
    "symbol": "AMD",
    "secType": "STOCK",
    "currency": "USD",
    "exchange": "IBKR"
  },
  "price_contract": {
    "symbol": "AMD",
    "secType": "STOCK",
    "currency": "USD",
    "exchange": "IBKR"
  },
  "ledgerPath": "data/TraderLedger/matrend001_amd_weekly_30k_ibkr_OPTIMIZED",
  "ledgerContextCollection": "matrend001_amd_weekly_30k_ibkr_OPTIMIZED_context"
}
