{
  "strategy_type": "MovingAverageCross",
  "trendMode": "MATREND-002",
  "fastWindow": 2,
  "middleWindow": 5,
  "slowWindow": 13,
  "orderQuantityInUSD": 30000.0,
  "orderQuantity": 97,
  "contract": {
    "symbol": "JPM",
    "secType": "STOCK",
    "currency": "USD",
    "exchange": "IBKR"
  },
  "price_contract": {
    "symbol": "JPM",
    "secType": "STOCK",
    "currency": "USD",
    "exchange": "IBKR"
  },
  "ledgerPath": "data/TraderLedger/MATREND002_JPM_WEEKLY_30K_IBKR",
  "ledgerContextCollection": "MATREND002_JPM_WEEKLY_30K_IBKR_context"
}
